{
  "battery_delta_percent_30m": 0,
  "device_model": "lab-device-tbd",
  "device_tier": "high",
  "evidence_paths": [
    "benchmarks/mt/results/mock-validation.json",
    "benchmarks/device-lab/samples/telemetry.mt.valid.jsonl",
    "benchmarks/device-lab/samples/model-manifest.milmmt.internal.json",
    "benchmarks/device-lab/samples/device-metadata.mt.fixture.json",
    "benchmarks/device-lab/samples/battery-thermal.mt.fixture.json",
    "benchmarks/device-lab/samples/package-evidence.milmmt.fixture.json",
    "benchmarks/device-lab/samples/runtime-conversion.milmmt.fixture.json",
    "benchmarks/device-lab/samples/legal-review.milmmt.fixture.json"
  ],
  "goal_id": "G010-offline-translation-real-runtime-and",
  "language_pair": "en->ru",
  "legal_review_status": "not_reviewed",
  "memory_peak_mb": 0,
  "model_id": "milmmt-46-4b-q6-gguf-high-tier",
  "os_version": "tbd",
  "p95_translation_latency_ms": 1,
  "package_size_mb": 2800.0,
  "quality_metric": "token_overlap_placeholder",
  "quality_score": 1.0,
  "result_type": "mt",
  "runtime_id": "mock-runtime",
  "support_decision": "not_claimed",
  "thermal_result": "not_measured"
}
